{
  "name": "@scope/sample",
  "description": "Representative npm packument fixture",
  "dist-tags": {
    "latest": "2.0.0"
  },
  "versions": {
    "1.0.0": {
      "name": "@scope/sample",
      "version": "1.0.0",
      "license": "MIT",
      "dependencies": {
        "left-pad": "^1.3.0"
      },
      "dist": {
        "tarball": "https://registry.npmjs.org/@scope/sample/-/sample-1.0.0.tgz",
        "shasum": "0123456789abcdef0123456789abcdef01234567",
        "integrity": "sha512-AAAAAAAAAAAAAAAAAAAAAAAAAAAAAAAAAAAAAAAAAAA="
      }
    },
    "2.0.0": {
      "name": "@scope/sample",
      "version": "2.0.0",
      "license": "Apache-2.0",
      "dependencies": {
        "left-pad": "^1.3.0",
        "semver": "^7.6.0"
      },
      "dist": {
        "tarball": "https://registry.npmjs.org/@scope/sample/-/sample-2.0.0.tgz",
        "shasum": "fedcba9876543210fedcba9876543210fedcba98",
        "integrity": "sha512-BBBBBBBBBBBBBBBBBBBBBBBBBBBBBBBBBBBBBBBBBBB="
      }
    }
  },
  "time": {
    "created": "2024-01-01T00:00:00.000Z",
    "1.0.0": "2024-01-01T00:00:00.000Z",
    "2.0.0": "2024-03-01T00:00:00.000Z"
  },
  "readme": "# @scope/sample"
}
